<?xml version="1.0" encoding="UTF-8"?>

<xs:schema xmlns:xs="http://www.w3.org/2001/XMLSchema">

    <xs:element name="feedbacks">

        <xs:complexType>

            <xs:sequence>

                <xs:element name="feedback" maxOccurs="unbounded">

                    <xs:complexType>

                        <xs:sequence>

                            <!-- 1. Name -->
                            <xs:element name="name" type="xs:string"/>

                            <!-- 2. Email -->
                            <xs:element name="email" type="xs:string"/>

                            <!-- 3. Rating: 1 to 5 -->
                            <xs:element name="rating">

                                <xs:simpleType>

                                    <xs:restriction base="xs:integer">

                                        <xs:minInclusive value="1"/>

                                        <xs:maxInclusive value="5"/>

                                    </xs:restriction>

                                </xs:simpleType>

                            </xs:element>

                            <!-- 4. Category -->
                            <xs:element name="category">

                                <xs:simpleType>

                                    <xs:restriction base="xs:string">

                                        <xs:enumeration value="Collection Service"/>

                                        <xs:enumeration value="E-Store"/>

                                        <xs:enumeration value="Customer Support"/>

                                        <xs:enumeration value="Website"/>

                                    </xs:restriction>

                                </xs:simpleType>

                            </xs:element>

                            <!-- 5. Comment -->
                            <xs:element name="comment" type="xs:string"/>

                        </xs:sequence>

                    </xs:complexType>

                </xs:element>

            </xs:sequence>

        </xs:complexType>

    </xs:element>

</xs:schema>