<?xml version="1.0" encoding="UTF-8"?> 
<?xml-stylesheet type="text/xsl" href="feedback5.xsl"?> 
<feedbacks xmlns:xsi="http://www.w3.org/2001/XMLSchema-instance" 
 xsi:noNamespaceSchemaLocation="feedback5.xsd"> 
 
 <feedback> 
 <name>Aastha</name> 
 <email>aastha@gmail.com</email> 
 <rating>5</rating> 
 <category>Collection Service</category> 
 <comment>Excellent service.</comment> 
 </feedback> 
 <feedback> 
 <name>Rahul</name> 
 <email>rahul@gmail.com</email> 
 <rating>3</rating> 
 <category>E-Store</category> 
 <comment>Good experience.</comment> 
 </feedback> 
 <feedback> 
 <name>Priya</name> 
 <email>priya@gmail.com</email> 
 <rating>4</rating> 
 <category>Customer Support</category> 
 <comment>Very helpful support.</comment> 
 </feedback> 
</feedbacks> 